PMID,Title,Abstract,Journal,Publication Date,DOI,Databases
30425250,Proteome-wide analysis of USP14 substrates revealed its role in hepatosteatosis via stabilization of FASN.,"Ubiquitin-specific protease 14 (USP14) is one of the major proteasome-associated deubiquitinating enzymes critical for proteome homeostasis. However, substrates of USP14 remain largely unknown, hindering the understanding of its functional roles. Here we conduct a comprehensive proteome, ubiquitinome and interactome analysis for USP14 substrate screening. Bioinformatics analysis reveals broad new potential roles of USP14, especially in lipid and carbohydrate metabolism. Among the potential substrates identified, we show that fatty acid synthase (FASN), a key enzyme involved in hepatic lipogenesis, is a bona fide substrate of USP14. USP14 directly interacts with and increases FASN stability. As a result, overexpression of USP14 promotes liver triglyceride accumulation in C57BL/6 mice, whereas genetic ablation or pharmacological inhibition of USP14 ameliorates hepatosteatosis, hyperglycemia and insulin resistance in obese mice. In conclusion, our findings reveal for the first time an indispensable role of USP14 in hepatosteatosis through FASN stabilization.",Nature communications,2018 Nov 13,10.1038/s41467-018-07185-y [pii],
30389639,Depletion of endogenous miRNA-378-3p increases peak cell density of CHO DP12 cells and is correlated with elevated levels of ubiquitin carboxyl-terminal hydrolase 14.,"miRNAs are potent molecular regulators of cellular behaviour. The manipulation of these small non-coding RNAs has been used to enhance industrially relevant phenotypes in Chinese Hamster Ovary (CHO) cells. We investigated the stable depletion of six miRNAs; miR-204-5p, 338-3p, 378-3p, 409-3p, 455-3p and 505-3p, robustly associated with cell growth rate from a previous profiling study. Inhibition of endogenous miR-378-3p function by miRNA-sponge-decoy improved peak cell density by 59%. Quantitative label free LC-MS/MS proteomic analysis of the fractionated cell cultures at day 4 and 8 of batch culture found 216 cytosolic and 114 membrane-associated proteins differentially expressed with stable miR-378-3p depletion. qRT-PCR of 8 genes; Clic4, Hnrnpa1, Prdx1, Actn4, Usp14, Srxn1, Canx and Gnb1, with unidirectional differential protein expression over the two time points of analysis was carried out. In-silico predictive algorithms; TargetScan and miRDB, were used to decipher possible direct targets of miR-378-3p. The Ubiquitin carboxyl-terminal hydrolase 14 (Usp14) protein was identified in the cytosolic fractions at both timepoints as differentially expressed with an increased abundance of 1.58-fold in the miR-378-3p depleted cells on day 8. Usp14 is a deubiquitinase (DUB) with previous reports of its up-regulation leading to increased proliferation of cancer cells. Overexpression of Usp14 in CHO cells had significant effects on cell growth supporting a role for Usp14 in the increased peak cell density seen with miR-378-3p depletion. This study highlights miR-378-3p as a novel engineering candidate for improving CHO cell growth. The use of subcellular fractionation also improved proteome coverage in the identification of novel miRNA targets.",Journal of biotechnology,2018 Dec 20,S0168-1656(18)30672-2 [pii],
29995557,USP14 regulates DNA damage repair by targeting RNF168-dependent ubiquitination.,"Recent reports have made important revelations, uncovering direct regulation of DNA damage response (DDR)-associated proteins and chromatin ubiquitination (Ubn) by macroautophagy/autophagy. Here, we report a previously unexplored connection between autophagy and DDR, via a deubiquitnase (DUB), USP14. Loss of autophagy in prostate cancer cells led to unrepaired DNA double-strand breaks (DSBs) as indicated by persistent ionizing radiation (IR)-induced foci (IRIF) formation for gammaH2AFX, and decreased protein levels and IRIF formation for RNF168, an E3-ubiquitin ligase essential for chromatin Ubn and recruitment of critical DDR effector proteins in response to DSBs, including TP53BP1. Consistently, RNF168-associated Ubn signaling and TP53BP1 IRIF formation were reduced in autophagy-deficient cells. An activity assay identified several DUBs, including USP14, which showed higher activity in autophagy-deficient cells. Importantly, inhibiting USP14 could overcome DDR defects in autophagy-deficient cells. USP14 IRIF formation and protein stability were increased in autophagy-deficient cells. Co-immunoprecipitation and colocalization of USP14 with MAP1LC3B and the UBA-domain of SQSTM1 identified USP14 as a substrate of autophagy and SQSTM1. Additionally, USP14 directly interacted with RNF168, which depended on the MIU1 domain of RNF168. These findings identify USP14 as a novel substrate of autophagy and regulation of RNF168-dependent Ubn and TP53BP1 recruitment by USP14 as a critical link between DDR and autophagy. Given the role of Ubn signaling in non-homologous end joining (NHEJ), the major pathway for repair of IR-induced DNA damage, these findings provide unique insights into the link between autophagy, DDR-associated Ubn signaling and NHEJ DNA repair. ABBREVIATIONS: ATG7: autophagy related 7; CQ: chloroquine; DDR: DNA damage response; DUB: deubiquitinase; HR: homologous recombination; IR: ionizing radiation; IRIF: ionizing radiation-induced foci; LAMP2: lysosomal associated membrane protein 2; MAP1LC3B/LC3B: microtubule associated protein 1 light chain 3 beta; MIU1: motif interacting with ubiquitin; NHEJ: non homologous end-joining; PCa: prostate cancer; TP53BP1/53BP1: tumor protein p53 binding protein 1; RNF168: ring finger protein 168; SQSTM1/p62 sequestosome 1; gammaH2AFX/gammaH2AX: H2A histone family member X: phosphorylated, UBA: ubiquitin-associated; Ub: ubiquitin; Ubn: ubiquitination; USP14: ubiquitin specific peptidase 14.",Autophagy,2018,1496877 [pii],
29777785,PSMD2 regulates breast cancer cell proliferation and cell cycle progression by modulating p21 and p27 proteasomal degradation.,"Alterations in the ubiquitin-proteasome system (UPS) and UPS-associated proteins have been implicated in the development of many human malignancies. In this study, we investigated the expression profiles of 797 UPS-related genes using HiSeq data from The Cancer Genome Atlas and identified that PSMD2 was markedly upregulated in breast cancer. High PSMD2 expression was significantly correlated with poor prognosis. Gene set enrichment analysis revealed that transcriptome signatures involving proliferation, cell cycle, and apoptosis were critically enriched in specimens with elevated PSMD2. Consistently, PSMD2 knockdown inhibited cell proliferation and arrested cell cycle at G0/G1 phase in vitro, as well as suppressed tumor growth in vivo. Rescue assays demonstrated that the cell cycle arrest caused by silencing PSMD2 partially resulted from increased p21 and/or p27. Mechanically, PSMD2 physically interacted with p21 and p27 and mediated their ubiquitin-proteasome degradation with the cooperation of USP14. Notably, intratumor injection of therapeutic PSMD2 small interfering RNA effectively delayed xenograft tumor growth accompanied by p21 and p27 upregulation. These data provide novel insight into the role of PSMD2 in breast cancer and suggest that PSMD2 may be a potential therapeutic target.",Cancer letters,2018 Aug 28,S0304-3835(18)30343-4 [pii],
29732405,Broad and diverse mechanisms used by deubiquitinase family members in regulating the type I interferon signaling pathway during antiviral responses.,"The innate immune response conferred by type I interferons is essential for host defense against viral infection but needs to be tightly controlled to avoid immunopathology. We performed a systematic functional screening by CRISPR/Cas9 (clustered regularly interspaced short palindromic repeats/CRISPR-associated protein 9) knockout and overexpression to investigate the roles of the deubiquitinating enzyme (DUB) family in regulating antiviral immunity. We demonstrated that the expression of a large fraction of DUBs underwent complex temporal alteration, suggesting a dynamic program of feedback regulation. Moreover, we identified previously unrecognized roles of a subset of DUBs, including USP5, USP14, USP22, USP48, USP52, COPS5, and BRCC3, in inhibiting antiviral immunity at various levels. We explored an unexpected mechanism where multiple DUBs, such as USP5 and USP22, form diverse signalosomes with E3 ligases or DUBs to alter the substrates' ubiquitination state instead of directly cleaving the ubiquitin chains on substrates via their protease activity. Altogether, our study has revealed a panoramic view of the broad and dynamic involvement of DUB family proteins in regulating antiviral responses.",Science advances,2018 May,aar2824 [pii],
27542828,USP14 regulates autophagy by suppressing K63 ubiquitination of Beclin 1.,"The ubiquitin-proteasome system (UPS) and autophagy are two major intracellular degradative mechanisms that mediate the turnover of complementary repertoires of intracellular proteomes. Simultaneously activating both UPS and autophagy might provide a powerful strategy for the clearance of misfolded proteins. However, it is not clear whether UPS and autophagy can be controlled by a common regulatory mechanism. K48 deubiquitination by USP14 is known to inhibit UPS. Here we show that USP14 regulates autophagy by negatively controlling K63 ubiquitination of Beclin 1. Furthermore, we show that activation of USP14 by Akt-mediated phosphorylation provides a mechanism for Akt to negatively regulate autophagy by promoting K63 deubiquitination. Our study suggests that Akt-regulated USP14 activity modulates both proteasomal degradation and autophagy through controlling K48 and K63 ubiquitination, respectively. Therefore, regulation of USP14 provides a mechanism for Akt to control both proteasomal and autophagic degradation. We propose that inhibition of USP14 may provide a strategy to promote both UPS and autophagy for developing novel therapeutics targeting neurodegenerative diseases.",Genes & development,2016 Aug 1,30/15/1718 [pii],
26471267,"Deubiquitinases Modulate Platelet Proteome Ubiquitination, Aggregation, and Thrombosis.","OBJECTIVE: Platelets express a functional ubiquitin-proteasome system. Mass spectrometry shows that platelets contain several deubiquitinases, but whether these are functional, modulate the proteome, or affect platelet reactivity are unknown. APPROACH AND RESULTS: Platelet lysates contained ubiquitin-protein deubiquitinase activity hydrolyzing both Lys48 and Lys63 polyubiquitin conjugates that was suppressed by the chemically unrelated deubiquitinase inhibitors PYR41 and PR619. These inhibitors acutely and markedly increased monoubiquitination and polyubiquitination of the proteome of resting platelets. PYR41 (intravenous, 15 minutes) significantly impaired occlusive thrombosis in FeCl3-damaged carotid arteries, and deubiquitinase inhibition reduced platelet adhesion and retention during high shear flow of whole blood through microfluidic chambers coated with collagen. Total internal reflection microscopy showed that adhesion and spreading in the absence of flow were strongly curtailed by these inhibitors with failure of stable process extension and reduced the retraction of formed clots. Deubiquitinase inhibition also sharply reduced homotypic platelet aggregation in response to not only the incomplete agonists ADP and collagen acting through glycoprotein VI but also to the complete agonist thrombin. Suppressed aggregation was accompanied by curtailed procaspase activating compound-1 binding to activated IIb/IIIa and inhibition of P-selectin translocation to the platelet surface. Deubiquitinase inhibition abolished the agonist-induced spike in intracellular calcium, suppressed Akt phosphorylation, and reduced agonist-stimulated phosphatase and tensin homolog phosphatase phosphorylation. Platelets express the proteasome-associated deubiquitinases USP14 and UCHL5, and selective inhibition of these enzymes by b-AP15 reproduced the inhibitory effect of the general deubiquitinase inhibitors on ex vivo platelet function. CONCLUSIONS: Remodeling of the ubiquitinated platelet proteome by deubiquitinases promotes agonist-stimulated intracellular signal transduction and platelet responsiveness.","Arteriosclerosis, thrombosis, and vascular biology",2015 Dec,ATVBAHA.115.306054 [pii],
25691154,"Targeted inhibition of the deubiquitinating enzymes, USP14 and UCHL5, induces proteotoxic stress and apoptosis in Waldenstrom macroglobulinaemia tumour cells.","Deubiquitinase enzymes (DUBs) of the proteasomal 19S regulatory particle are emerging as important therapeutic targets in several malignancies. Here we demonstrate that inhibition of two proteasome-associated DUBs (USP14 and UCHL5) with the small molecule DUB inhibitor b-AP15, results in apoptosis of human Waldenstrom macroglobulinaemia (WM) cell lines and primary patient-derived WM tumour cells. Importantly, b-AP15 produced proteotoxic stress and apoptosis in WM cells that have acquired resistance to the proteasome inhibitor bortezomib. In silico modelling identified protein residues that were critical for the binding of b-AP15 with USP14 or UCHL5 and proteasome enzyme activity assays confirmed that b-AP15 does not affect the proteolytic capabilities of the 20S proteasome beta-subunits. In vitro toxicity from b-AP15 appeared to result from a build-up of ubiquitinated proteins and activation of the endoplasmic reticulum stress response in WM cells, an effect that also disrupted the mitochondria. Focused transcriptome profiling of b-AP15-treated WM cells revealed modulation of several genes regulating cell stress and NF-kappaB signalling, the latter whose protein translocation and downstream target activation was reduced by b-AP15 in vitro. This is the first report to define the effects and underlying mechanisms associated with inhibition of USP14 and UCHL5 DUB activity in WM tumour cells.",British journal of haematology,2015 May,10.1111/bjh.13304,
24472655,NitroDIGE analysis reveals inhibition of protein S-nitrosylation by epigallocatechin gallates in lipopolysaccharide-stimulated microglial cells.,"BACKGROUND: Nitric oxide (NO) is a signaling molecule regulating numerous cellular functions in development and disease. In the brain, neuronal injury or neuroinflammation can lead to microglial activation, which induces NO production. NO can react with critical cysteine thiols of target proteins forming S-nitroso-proteins. This modification, known as S-nitrosylation, is an evolutionarily conserved redox-based post-translational modification (PTM) of specific proteins analogous to phosphorylation. In this study, we describe a protocol for analyzing S-nitrosylation of proteins using a gel-based proteomic approach and use it to investigate the modes of action of a botanical compound found in green tea, epigallocatechin-3-gallate (EGCG), on protein S-nitrosylation after microglial activation. METHODS/RESULTS: To globally and quantitatively analyze NO-induced protein S-nitrosylation, the sensitive gel-based proteomic method, termed NitroDIGE, was developed by combining two-dimensional differential in-gel electrophoresis (2-D DIGE) with the modified biotin switch technique (BST) using fluorescence-tagged CyDye thiol reactive agents to label S-nitrosothiols. The NitroDIGE method showed high specificity and sensitivity in detecting S-nitrosylated proteins (SNO-proteins). Using this approach, we identified a subset of SNO-proteins ex vivo by exposing immortalized murine BV-2 microglial cells to a physiological NO donor, or in vivo by exposing BV-2 cells to endotoxin lipopolysaccharides (LPS) to induce a proinflammatory response. Moreover, EGCG was shown to attenuate S-nitrosylation of proteins after LPS-induced activation of microglial cells primarily by modulation of the nuclear factor erythroid 2-related factor 2 (Nrf2)-mediated oxidative stress response. CONCLUSIONS: These results demonstrate that NitroDIGE is an effective proteomic strategy for ""top-down"" quantitative analysis of protein S-nitrosylation in multi-group samples in response to nitrosative stress due to excessive generation of NO in cells. Using this approach, we have revealed the ability of EGCG to down-regulate protein S-nitrosylation in LPS-stimulated BV-2 microglial cells, consistent with its known antioxidant effects.",Journal of neuroinflammation,2014 Jan 28,1742-2094-11-17 [pii],
24011031,Induction of tumor cell apoptosis by a proteasome deubiquitinase inhibitor is associated with oxidative stress.,"AIMS: b-AP15 is a recently described inhibitor of the USP14/UCHL5 deubiquitinases (DUBs) of the 19S proteasome. Exposure to b-AP15 results in blocking of proteasome function and accumulation of polyubiquitinated protein substrates in cells. This novel mechanism of proteasome inhibition may potentially be exploited for cancer therapy, in particular for treatment of malignancies resistant to currently used proteasome inhibitors. The aim of the present study was to characterize the cellular response to b-AP15-mediated proteasome DUB inhibition. RESULTS: We report that b-AP15 elicits a similar, but yet distinct, cellular response as the clinically used proteasome inhibitor bortezomib. b-AP15 induces a rapid apoptotic response, associated with enhanced induction of oxidative stress and rapid activation of Jun-N-terminal kinase 1/2 (JNK)/activating protein-1 signaling. Scavenging of reactive oxygen species and pharmacological inhibition of JNK reduced b-AP15-induced apoptosis. We further report that endoplasmic reticulum (ER) stress is induced by b-AP15 and is involved in apoptosis induction. In contrast to bortezomib, ER stress is associated with induction of alpha-subunit of eukaryotic initiation factor 2 phosphorylation. INNOVATION: The findings establish that different modes of proteasome inhibition result in distinct cellular responses, a finding of potential therapeutic importance. CONCLUSION: Our data show that enhanced oxidative stress and ER stress are major determinants of the strong apoptotic response elicited by the 19S DUB inhibitor b-AP15.",Antioxidants & redox signaling,2014 Dec 10,10.1089/ars.2013.5322 [pii],
22792064,Antiviral activity of a small molecule deubiquitinase inhibitor occurs via induction of the unfolded protein response.,"Ubiquitin (Ub) is a vital regulatory component in various cellular processes, including cellular responses to viral infection. As obligate intracellular pathogens, viruses have the capacity to manipulate the ubiquitin (Ub) cycle to their advantage by encoding Ub-modifying proteins including deubiquitinases (DUBs). However, how cellular DUBs modulate specific viral infections, such as norovirus, is poorly understood. To examine the role of DUBs during norovirus infection, we used WP1130, a small molecule inhibitor of a subset of cellular DUBs. Replication of murine norovirus in murine macrophages and the human norovirus Norwalk virus in a replicon system were significantly inhibited by WP1130. Chemical proteomics identified the cellular DUB USP14 as a target of WP1130 in murine macrophages, and pharmacologic inhibition or siRNA-mediated knockdown of USP14 inhibited murine norovirus infection. USP14 is a proteasome-associated DUB that also binds to inositol-requiring enzyme 1 (IRE1), a critical mediator of the unfolded protein response (UPR). WP1130 treatment of murine macrophages did not alter proteasome activity but activated the X-box binding protein-1 (XBP-1) through an IRE1-dependent mechanism. In addition, WP1130 treatment or induction of the UPR also reduced infection of other RNA viruses including encephalomyocarditis virus, Sindbis virus, and La Crosse virus but not vesicular stomatitis virus. Pharmacologic inhibition of the IRE1 endonuclease activity partially rescued the antiviral effect of WP1130. Taken together, our studies support a model whereby induction of the UPR through cellular DUB inhibition blocks specific viral infections, and suggest that cellular DUBs and the UPR represent novel targets for future development of broad spectrum antiviral therapies.",PLoS pathogens,2012,PPATHOGENS-D-11-02480 [pii],
20823120,Trimming of ubiquitin chains by proteasome-associated deubiquitinating enzymes.,"The proteasome generally recognizes substrate via its multiubiquitin chain followed by ATP-dependent unfolding and translocation of the substrate from the regulatory particle into the proteolytic core particle to be degraded. Substrate-bound ubiquitin groups are for the most part not delivered to the core particle and broken down together with substrate but instead recovered as intact free ubiquitin and ubiquitin chains. Substrate deubiquitination on the proteasome is mediated by three distinct deubiquitinating enzymes associated with the regulatory particle: RPN11, UCH37, and USP14. RPN11 cleaves at the base of the ubiquitin chain where it is linked to the substrate, whereas UCH37 and apparently USP14 mediate a stepwise removal of ubiquitin from the substrate by disassembling the chain from its distal tip. In contrast to UCH37 and USP14, RPN11 shows degradation-coupled activity; RPN11-mediated deubiquitination is apparently delayed until the proteasome is committed to degrade the substrate. Accordingly, RPN11-mediated deubiquitination promotes substrate degradation. In contrast, removal of ubiquitin prior to commitment could antagonize substrate degradation by promoting substrate dissociation from the proteasome. Emerging evidence suggests that USP14 and UCH37 can both suppress substrate degradation in this way. One line of study has shown that small molecule USP14 inhibitors can enhance proteasome function in cells, which is consistent with this model. Enhancing protein degradation could potentially have therapeutic applications for diseases involving toxic proteins that are proteasome substrates. However, the responsiveness of substrates to inhibition of proteasomal deubiquitinating enzymes may vary substantially. This substrate specificity and its mechanistic basis should be addressed in future studies.",Molecular & cellular proteomics : MCP,2011 May,S1535-9476(20)30234-6 [pii],
